{
  "$schema": "https://json-schema.org/draft/2020-12/schema", "title": "DeliveryManifest",
  "type": "object", "additionalProperties": false,
  "required": ["schema_version", "kind", "status", "input_hashes", "files", "created_at"],
  "properties": {
    "schema_version": {"const": "1.0"}, "kind": {"const": "delivery_manifest"}, "status": {"const": "completed"},
    "input_hashes": {"type": "object", "minProperties": 4, "additionalProperties": {"type": "string", "pattern": "^[a-f0-9]{64}$"}},
    "files": {"type": "array", "minItems": 1, "items": {"type": "object", "additionalProperties": false, "required": ["role", "path", "sha256"], "properties": {"role": {"type": "string"}, "path": {"type": "string"}, "sha256": {"type": "string", "pattern": "^[a-f0-9]{64}$"}}}},
    "created_at": {"type": "string", "format": "date-time"}
  }
}
