{
  "schema_version": "1.0",
  "kind": "delivery_manifest",
  "status": "completed",
  "input_hashes": {
    "content_review_gate": "331d8c80ad247f8bd26e9159100adc6ea2d8bc6595347f610eb01ea62135d57d",
    "content_split_gate": "e65191080a4eb463ba3f0bfdcd371236d9469c6b87c261e8dfe3a54b6d4c33b7",
    "render_gate": "2e82d7493a4cdab7a1ca6596b8509d5c4d60e58db63ee30913bca1b89420bd21",
    "public_copy_gate": "d6672ca9a5970f0f94b015ad42d9e5f9934d83cebee74ed63834d446d666e501",
    "accepted_artwork_import": "a68dc85a852a7a481a9a5c35937f43275bbf8739c0813c4c859a75b33508f2e5"
  },
  "files": [
    {
      "role": "page_png:P00",
      "path": "00-cover.png",
      "sha256": "99bdf2c43f73d6cb2529594dba66eb49de5406f248201a4a74a3e1e5eb8a692d"
    },
    {
      "role": "page_phone_png:P00",
      "path": "00-cover-phone.png",
      "sha256": "6fb59d77364029d65aeb8f1ec45e87c4c04f6f7c01b7fb4e94ea6e5c73068127"
    },
    {
      "role": "page_grayscale_png:P00",
      "path": "00-cover-grayscale.png",
      "sha256": "16d6edbd5c130be7b73405863d9c029e350731b92489ac1476ef6f3f03f78020"
    },
    {
      "role": "page_scene:P00",
      "path": "00-cover.excalidraw",
      "sha256": "52891194e46d22621d0f26b31db88abfc3f0277d962107c180b2ed45d05bc943"
    },
    {
      "role": "rendered_page_check:P00",
      "path": "qa-00-cover.md",
      "sha256": "15ec741b216ab677447b577324655bce12ee776312d24065895a27900b0f4c14"
    },
    {
      "role": "page_png:P01",
      "path": "01-overview.png",
      "sha256": "53cd62848b1a2a42680958464868f4967631f66eb79cd2e8751a381a07086774"
    },
    {
      "role": "page_phone_png:P01",
      "path": "01-overview-phone.png",
      "sha256": "d2fd8caa68a202d13ee87280b4e87db10626ef7d91f9def7d77967c662408705"
    },
    {
      "role": "page_grayscale_png:P01",
      "path": "01-overview-grayscale.png",
      "sha256": "d9ab59d467324f9f9d44bd17f3abb8ecddf349824853257c2a88787514d62874"
    },
    {
      "role": "page_scene:P01",
      "path": "01-overview.excalidraw",
      "sha256": "c32569a4e3c9d2142cf82d61a49d214759df004a32fde4ba0c57752b8455d0ee"
    },
    {
      "role": "rendered_page_check:P01",
      "path": "qa-01-overview.md",
      "sha256": "4f8ce622b05bb5eb435ac6a06a61f789f7337dbfffc79c0f33e898044cf9ba4d"
    },
    {
      "role": "page_png:P02",
      "path": "02-P02.png",
      "sha256": "11356fa9d1c312918ea8c460d34b124258331af0fadb114a96a26e72b8f62d76"
    },
    {
      "role": "page_phone_png:P02",
      "path": "02-P02-phone.png",
      "sha256": "7b5e07e2ba71112e8d69480277ad48b99f96f39aac44f7769b09e283798d412d"
    },
    {
      "role": "page_grayscale_png:P02",
      "path": "02-P02-grayscale.png",
      "sha256": "13889eec56c41a8a28edacc2dc3d1176bbd5b60fcfeaef94210173f4c8fc48d4"
    },
    {
      "role": "page_scene:P02",
      "path": "02-P02.excalidraw",
      "sha256": "120c7c16b7eb587a042a08d193fac7551d0d9c6e37f7ae4e8fcd8c7bf44ed1e1"
    },
    {
      "role": "rendered_page_check:P02",
      "path": "qa-02-P02.md",
      "sha256": "dd8d276cb4dd857199711b8fea690fa3fad6b517de3d79bebfa19faa0acbb617"
    },
    {
      "role": "page_png:P03",
      "path": "03-P03.png",
      "sha256": "906a816a2d931fba5271daca2d2107fe960c949eef18e29077f9acdafff335cc"
    },
    {
      "role": "page_phone_png:P03",
      "path": "03-P03-phone.png",
      "sha256": "fe130a9b09b56602e32a6df7dd3206b654c7f92f2ad9834a14c2710c2903e9ec"
    },
    {
      "role": "page_grayscale_png:P03",
      "path": "03-P03-grayscale.png",
      "sha256": "8361d018b6a5dca01e90ca605d805977767bcf76a0b1cf322e31cbd79d521d53"
    },
    {
      "role": "page_scene:P03",
      "path": "03-P03.excalidraw",
      "sha256": "7093bfaa58d83271a47ff1f8ac21e6bca7edb5f937211ce2be93b4f8742706d0"
    },
    {
      "role": "rendered_page_check:P03",
      "path": "qa-03-P03.md",
      "sha256": "66c352e28cf204794ee796b069e6826636c03551c203d8fc0facdfab7ee954a0"
    },
    {
      "role": "page_png:P04",
      "path": "04-P04.png",
      "sha256": "74c9c697a02b9b3ffb824d8c19faefc7567bd30d52c7e91ab12776357dda207c"
    },
    {
      "role": "page_phone_png:P04",
      "path": "04-P04-phone.png",
      "sha256": "fa3fb85f388c9334b66c5d0af2acdb4db35d9b5aa5a694a495ab3db40febc0bc"
    },
    {
      "role": "page_grayscale_png:P04",
      "path": "04-P04-grayscale.png",
      "sha256": "a99a8055be8174bcea66c058a95f81ddb2bee358ce13a53b5d060113beb9f5ea"
    },
    {
      "role": "page_scene:P04",
      "path": "04-P04.excalidraw",
      "sha256": "709fb8d024a3dd7e71bb0a594e3d93ecd8871cd00e470b6d72aa64447db95d36"
    },
    {
      "role": "rendered_page_check:P04",
      "path": "qa-04-P04.md",
      "sha256": "71db3e3f8e21d188f82d066d04a68bf6febc30ef1e19487d9dcd445e4fa536e3"
    },
    {
      "role": "page_png:P05",
      "path": "05-P05.png",
      "sha256": "76fc3538348a0f39a32eb0df5ef093653bf2fb701e95f1d34a4fd06387b82864"
    },
    {
      "role": "page_phone_png:P05",
      "path": "05-P05-phone.png",
      "sha256": "61417e306925285056f538affe6e1809699cdbd847f05a21547958dd886d62f9"
    },
    {
      "role": "page_grayscale_png:P05",
      "path": "05-P05-grayscale.png",
      "sha256": "71a7fce45a44e043a9116a910f9395d1481c982d8434eefac35d9adceaf24945"
    },
    {
      "role": "page_scene:P05",
      "path": "05-P05.excalidraw",
      "sha256": "85129d9d9659a51a7719a2ea473b3724077b7955e90d2b05ff03d1332cc630ed"
    },
    {
      "role": "rendered_page_check:P05",
      "path": "qa-05-P05.md",
      "sha256": "52804bb88bbef74d1b0ea77758fadefdcf72742b04f57e0619e6651114721ed0"
    },
    {
      "role": "page_png:P06",
      "path": "06-P06.png",
      "sha256": "f604db9fb0abfa918b5950e0e8b810c65c52d723f8c7d516c743f601f969ed5f"
    },
    {
      "role": "page_phone_png:P06",
      "path": "06-P06-phone.png",
      "sha256": "324ba4c9b0f287a98e2faa493571a03d46ad30814fdc6fc595374039e149bcf7"
    },
    {
      "role": "page_grayscale_png:P06",
      "path": "06-P06-grayscale.png",
      "sha256": "57427a3793f23ce00e4d879a466ad473d8c9ab8ab7a07d6d986d4fbd2c25c2d3"
    },
    {
      "role": "page_scene:P06",
      "path": "06-P06.excalidraw",
      "sha256": "c10aded51055d198d6b30ae5e7e3dbef6a0c875702ba933884380140beca3ef9"
    },
    {
      "role": "rendered_page_check:P06",
      "path": "qa-06-P06.md",
      "sha256": "985176e4730ed1836a6be29da8e332f51fca40100fdccdb46684d09e710d4b95"
    },
    {
      "role": "page_png:P07",
      "path": "07-P07.png",
      "sha256": "b6e91a52a01af797f19097e2271bb278684bf2fc8a6d8e06de145b0cd108ced6"
    },
    {
      "role": "page_phone_png:P07",
      "path": "07-P07-phone.png",
      "sha256": "465759fd8a57473da56b69c5b16b3354d98017215e9be04900881e99118a26b0"
    },
    {
      "role": "page_grayscale_png:P07",
      "path": "07-P07-grayscale.png",
      "sha256": "058e7f821aa2aa649404e13935da8580199bfd962f539480dded218c3d56b144"
    },
    {
      "role": "page_scene:P07",
      "path": "07-P07.excalidraw",
      "sha256": "73bb407a9696aab1029cc27bd00c4ca672364d38c656c73d8e5cd116ddd402eb"
    },
    {
      "role": "rendered_page_check:P07",
      "path": "qa-07-P07.md",
      "sha256": "78bc1356554c6f97a049f6ef5e7116f0c1dabd8edd4d0e2348d2edc53274a855"
    },
    {
      "role": "page_png:P08",
      "path": "08-P08.png",
      "sha256": "6bef58812cb4cdbb2508ca04cdb4bd48f32637a391bc3a32918391693a269217"
    },
    {
      "role": "page_phone_png:P08",
      "path": "08-P08-phone.png",
      "sha256": "b7b9ebb87ac9e281a3ad8ec54fe8969ff5f6da535e8c9d8439238677d8823b23"
    },
    {
      "role": "page_grayscale_png:P08",
      "path": "08-P08-grayscale.png",
      "sha256": "633995e30d4d6cff295c0019d6c98f384e7382e83d15dc4437dc4c2880614c7a"
    },
    {
      "role": "page_scene:P08",
      "path": "08-P08.excalidraw",
      "sha256": "9159a00bf274746485ca07f2d9d25efde240310faa486d2849e35442f958f90c"
    },
    {
      "role": "rendered_page_check:P08",
      "path": "qa-08-P08.md",
      "sha256": "c4756231d919b550a7d4629f5a5ceab05beb505a467db47e64fdd9cb204bc97a"
    },
    {
      "role": "page_png:P09",
      "path": "09-P09.png",
      "sha256": "d22ba0cdeb1772c948d815d117c13881eb3157852dd7b62b51ca4a0ed233e07e"
    },
    {
      "role": "page_phone_png:P09",
      "path": "09-P09-phone.png",
      "sha256": "e1fec9660bb85a21ee134fb98514d043ac4d9f0bdf62b9537076b733c9d10fca"
    },
    {
      "role": "page_grayscale_png:P09",
      "path": "09-P09-grayscale.png",
      "sha256": "7df8616aec3a684aaa0c012b70f38b268cc1112b3b8f9de673420ab8e52d529f"
    },
    {
      "role": "page_scene:P09",
      "path": "09-P09.excalidraw",
      "sha256": "ea026c3ce0d7aba1725fb7f5f7ba4b4a598589fed100bff33120c717c8d43336"
    },
    {
      "role": "rendered_page_check:P09",
      "path": "qa-09-P09.md",
      "sha256": "b4aca2de8df7dd2594a4148a05dbd29a70aed9b8d3a3c93adad3d5267361a0b7"
    },
    {
      "role": "page_png:P10",
      "path": "10-P10.png",
      "sha256": "9cfd326505ed66f389827e83dce539b91d8022633b93948b06d22bedbd38b9e7"
    },
    {
      "role": "page_phone_png:P10",
      "path": "10-P10-phone.png",
      "sha256": "22f29972841092c7c46d09682074274f1a2c4a6c6df5c6d1c6dab73286440fab"
    },
    {
      "role": "page_grayscale_png:P10",
      "path": "10-P10-grayscale.png",
      "sha256": "728c692288ae18db0b5849068ed98b046327111e841dc53f087865b017a6df1c"
    },
    {
      "role": "page_scene:P10",
      "path": "10-P10.excalidraw",
      "sha256": "58baf1749ba848c99bc3116bb71be4132feaea97d18e612b4b34e2de2455cd30"
    },
    {
      "role": "rendered_page_check:P10",
      "path": "qa-10-P10.md",
      "sha256": "8c91aaea7e7bc091122e292a5a51ac3662b57fb3bcadb16c54991254d40e6153"
    },
    {
      "role": "page_png:P11",
      "path": "11-P11.png",
      "sha256": "405d073d8227e008791a86dbeafdfb785088528f83ae78a4006a6ea82eef2388"
    },
    {
      "role": "page_phone_png:P11",
      "path": "11-P11-phone.png",